{
  "schemaVersion": 1,
  "park": {
    "name": "rctai: register",
    "size": { "width": 96, "height": 96 },
    "baseScenario": null,
    "entrance": { "x": 46, "y": 4, "direction": 2 }
  },
  "rides": [
    {
      "id": "PR-101", "name": "Bump deps and fix lint", "archetype": "gentle_micro",
      "rideType": "spiral_slide", "rideObject": null,
      "footprint": { "w": 3, "h": 3 }, "position": { "x": 10, "y": 14 }, "rotation": 0,
      "colours": { "main": 6, "additional": 14, "support": 1, "track": 0 },
      "intensity": { "excitement": 2.1, "intensity": 1.8, "nausea": 2.6 },
      "sign": "PR #101 - Bump deps (alice)",
      "axes": { "size": 0.18, "adventure": 0.12, "risk": 0.10 },
      "track": null
    },
    {
      "id": "PR-102", "name": "Caching layer", "archetype": "looping_coaster",
      "rideType": "corkscrew_rc", "rideObject": null,
      "footprint": { "w": 9, "h": 7 }, "position": { "x": 26, "y": 12 }, "rotation": 0,
      "colours": { "main": 22, "additional": 22, "support": 18, "track": 2 },
      "intensity": { "excitement": 7.0, "intensity": 7.4, "nausea": 4.6 },
      "sign": "PR #102 - Caching layer (bob)",
      "axes": { "size": 0.74, "adventure": 0.80, "risk": 0.34 },
      "track": [ { "type": 1 }, { "type": 2 }, { "type": 3 } ]
    },
    {
      "id": "PR-103", "name": "Hotfix legacy import", "archetype": "drop_thrill",
      "rideType": "launched_freefall", "rideObject": null,
      "footprint": { "w": 3, "h": 3 }, "position": { "x": 14, "y": 26 }, "rotation": 0,
      "colours": { "main": 21, "additional": 21, "support": 12, "track": 0 },
      "intensity": { "excitement": 5.2, "intensity": 8.9, "nausea": 7.1 },
      "sign": "PR #103 - Hotfix (carol) RISKY",
      "axes": { "size": 0.22, "adventure": 0.40, "risk": 0.88 },
      "track": null
    },
    {
      "id": "PR-104", "name": "Settlement engine rewrite", "archetype": "mega_coaster",
      "rideType": "giga_coaster", "rideObject": null,
      "footprint": { "w": 14, "h": 11 }, "position": { "x": 44, "y": 22 }, "rotation": 0,
      "colours": { "main": 20, "additional": 20, "support": 0, "track": 26 },
      "intensity": { "excitement": 9.1, "intensity": 9.4, "nausea": 6.2 },
      "sign": "PR #104 - Settlement rewrite (bob) SHOWPIECE",
      "axes": { "size": 0.97, "adventure": 0.86, "risk": 0.72 },
      "track": [ { "type": 1 }, { "type": 60 }, { "type": 60 }, { "type": 2 } ]
    },
    {
      "id": "PR-105", "name": "Docs update", "archetype": "stall",
      "rideType": "information_kiosk", "rideObject": null,
      "footprint": { "w": 1, "h": 1 }, "position": { "x": 12, "y": 34 }, "rotation": 0,
      "colours": { "main": 24, "additional": 0, "support": 0, "track": 0 },
      "intensity": { "excitement": 0, "intensity": 0, "nausea": 0 },
      "sign": "PR #105 - Docs (dave)",
      "axes": { "size": 0.20, "adventure": 0.05, "risk": 0.05 },
      "track": null
    }
  ],
  "paths": [
    { "from": "entrance", "to": "PR-104" },
    { "from": "PR-104", "to": "PR-102" },
    { "from": "PR-102", "to": "PR-101" },
    { "from": "PR-101", "to": "PR-103" },
    { "from": "PR-101", "to": "PR-105" }
  ],
  "scenery": []
}
